{"claim_id":"sha256:cf49ba326023570fa74504ca8afba4771809b77534e57dedebf54bdb7d26308a","evidence_id":"sha256:409f6047952330a1467384f8eafaa173408b841cf6671e2cc3811ed02fb7df65","harness":{"input_sha256":{".github/workflows/cdk-cli-blackbox.yml":"sha256:bd0d5cb8d0c57c18e1015838f59bcc53e49c53885f992a5c06e839874dc46f6d",".python-version":"sha256:02e735b3dfe1c32833eb550b7ff8ffa17f5f2bc3fa1e7bae61a8f5a3883ce398","Makefile":"sha256:0262d5bdf0fed96acb75db5362cad458209c47c45026e8aa85e51c71da1fd5de","capabilities/cdk/compatibility.json":"sha256:d47e9819a4ae611f3c840bbea24f88715e0e4c3f5dacbf9f39c7ef10f05a05e2","capabilities/cdk/execution-evidence.schema.json":"sha256:3a000fbd78d03902ecc925fa5b2870ccb300796a3fb7dbdd025789a2259388fb","localstack-core/localstack/cli/_cdk_health_probe.py":"sha256:364746a7edbeb04b5db932c7e79097960782485ddfad9af65e9d2ef7f1ec4941","localstack-core/localstack/cli/cdk.py":"sha256:5ff91068ded44552f07509dfc37ddf0bb82fce29208141c9e8a33d9dccf89639","pyproject.toml":"sha256:800196f9cb7be1b7c723edacdfed7c8916fc03d29487a6dfcd8069eb4c33b67d","requirements-test.txt":"sha256:5f3e38dc3b4cb5a447d7aa764b696e92d402411814cb99418480f81fb65f5379","scripts/run_cdk_cli_blackbox_isolated.sh":"sha256:a4b50625efbeefcfa988fc123fc5311332c47cfe8d88c609c54b767eaf53ef2b","tests/aws/cli/execution_evidence.py":"sha256:92edf1507ddf26ea70b5ffe3055b9d301f4eeca2cf8719e7ade58d611deaf2cf","tests/aws/cli/package-lock.json":"sha256:3ef373a339aebe1620b6280f0c07c2b868b11ee89b982529a7bd91e8db7e1d33","tests/aws/cli/package.json":"sha256:2d3162fd15c72d6260536acae6461eca4fd5f0403b9f173d3b2ab77770c5c75d","tests/aws/cli/test_cdk_cli_blackbox.py":"sha256:3eb4695d346097e4a39b8b6060c63fd6df8f88476b4ce9f8b1a4e1de08f232ef","tests/aws/cli/validate_junit.py":"sha256:ec3cfe049ea137011a98552b29c90900460a7a4c0246d76a33b9578bb6c2b385","tests/aws/templates/cdk_bootstrap_v32.yaml":"sha256:a484ad768d3446874161044d986bec096e201a54037c8ce93ed5a0d215e1dd25"}},"lanes":[{"isolation":{"interface_names":["lo"],"profile_id":"linux-net-pid-mount-nobody-v1"},"junit_bytes":385,"junit_sha256":"sha256:e9a81aa2c51a5c5c82d530f37da18c269ae1b6c896adaa5521ee4d58b557329f","kernel_release":"6.17.0-1020-azure","machine_arch":"x86_64","node_arch":"x64","observed_at":"2026-08-09T01:47:56.451976Z","platform_id":"linux-amd64","python_version":"3.13.14","receipt_id":"sha256:9400a7db98de1ff68dfecf7296db846c775212270bbbfcd3afe714c3a488cb93","result":{"duration_ms":811,"returncode":0,"status":"pass","stderr_bytes":0,"stderr_sha256":"sha256:e3b0c44298fc1c149afbf4c8996fb92427ae41e4649b934ca495991b7852b855","stderr_truncated":false,"stdout_bytes":25625,"stdout_sha256":"sha256:ed382e6eaab4bfddfe9b4fdb5a81fed0dfb7cc1dc6118fb11c41a0381377e89f","stdout_truncated":false,"timed_out":false}},{"isolation":{"interface_names":["lo"],"profile_id":"linux-net-pid-mount-nobody-v1"},"junit_bytes":385,"junit_sha256":"sha256:f4761d346ed84adccd7f77c134e5d9b4d021d09a88fff4796432f6e944e2e521","kernel_release":"6.17.0-1020-azure","machine_arch":"aarch64","node_arch":"arm64","observed_at":"2026-08-09T01:47:43.954731Z","platform_id":"linux-arm64","python_version":"3.13.14","receipt_id":"sha256:a51766164d46c427600a96fca92dac2639001fa2ba7719701196997637b735f5","result":{"duration_ms":694,"returncode":0,"status":"pass","stderr_bytes":0,"stderr_sha256":"sha256:e3b0c44298fc1c149afbf4c8996fb92427ae41e4649b934ca495991b7852b855","stderr_truncated":false,"stdout_bytes":25625,"stdout_sha256":"sha256:ed382e6eaab4bfddfe9b4fdb5a81fed0dfb7cc1dc6118fb11c41a0381377e89f","stdout_truncated":false,"timed_out":false}}],"mode":"candidate","promotion":{"blockers":["no-bootstrap-deploy","no-cloud-assembly","no-language-binding","no-aws-differential"],"eligible":false},"record_type":"aggregate","run":{"event":"push","provider":"github-actions","run_attempt":1,"run_id":31288954038,"workflow_path":".github/workflows/cdk-cli-blackbox.yml"},"scenario":{"aws_differential":false,"cloud_assembly_produced":false,"construct_language":null,"id":"bootstrap-show-template-v32","resource_deployment_performed":false,"result":"cli-pass"},"schema_version":1,"subject":{"commit_sha":"1a23acd9b65fef0ef5a944bd4b412f9af9348665","ref":"refs/heads/main","repository":"cassiolpaixao90/localstack"},"toolchain":{"bootstrap_version":32,"cdk_cli_version":"2.1135.1","node_version":"22.23.2","npm_integrity":"sha512-g1jcMfWlyYtGamFJ/kPBOCuchl3NfwTF2UwOLTIDN0nJbGm84EAO+c8DlYnaemM8UmKFkdoq4BGdmiNL5nHWwA==","reference_template_byte_sha256":"sha256:a484ad768d3446874161044d986bec096e201a54037c8ce93ed5a0d215e1dd25","template_semantic_sha256":"sha256:9e04a3226e702258e2ba13063dc6ecbc6fba7880d9fa27298445499db453013a"}}
